### ISSUE TITLE
[Bug]: Local embedding model test uses correct URL, but knowledge base configuration uses different URL, causing inability to use local knowledge base.

### ISSUE THREAD

**Issue by suocean16** [CherryHQ/cherry-studio#11683]
> [!NOTE]
> This issue/comment/review was translated by Claude.

### Issue Checklist

- [x] I understand that issues are for feedback and problem solving, not for complaining in the comment section, and will provide as much information as possible to help solve the problem.
- [x] My issue is not listed in the [FAQ](https://github.com/CherryHQ/cherry-studio/issues/3881).
- [x] I've looked at **pinned issues** and searched for existing [Open Issues](https://github.com/CherryHQ/cherry-studio/issues), [Closed Issues](https://github.com/CherryHQ/cherry-studio/issues?q=is%3Aissue%20state%3Aclosed), and [Discussions](https://github.com/CherryHQ/cherry-studio/discussions), no similar issue or discussion was found.
- [x] I've filled in short, clear headings so that developers can quickly identify a rough idea of what to expect when flipping through the list of issues. And not "a suggestion", "stuck", etc.
- [x] I've confirmed that I am using the latest version of Cherry Studio.

### Platform

Windows

### Version

1.7.1

### Bug Description

In the Windows interface, clicking on model test works successfully.
The ollama packet capture is as follows. Note the URL.

\`\`\`
root@pc142:/home/osu/ollama_osu# sudo tcpdump -A -s 1500 'tcp port 3389 and (tcp[((tcp[12:1] & 0xf0) >> 2):4] = 0x47455420 or tcp[((tcp[12:1] & 0xf0) >> 2):4] = 0x504f5354)'
libibverbs: Warning: couldn't open config directory '/etc/libibverbs.d'.
tcpdump: verbose output suppressed, use -v[v]... for full protocol decode
listening on eno1np0, link-type EN10MB (Ethernet), snapshot length 1500 bytes

05:28:18.377057 IP 172.31.156.162.18540 > pc142.ms-wbt-server: Flags [P.], seq 4006168713:4006169286, ack 910096718, win 255, length 573
E..eWi@.x.m.......FoHl.=..H.6>.NP.......POST /v1/embeddings HTTP/1.1
Host: 172.29.70.111:3389
Connection: keep-alive
Content-Length: 67
authorization: Bearer
x-stainless-retry-count: 0
x-api-key:
x-title: Cherry Studio
User-Agent: Mozilla/5.0 (Windows NT 10.0; Win64; x64) AppleWebKit/537.36 (KHTML, like Gecko) CherryStudio/1.7.1 Chrome/140.0.7339.249 Electron/38.7.0 Safari/537.36
accept: application/json
http-referer: https://cherry-ai.com
content-type: application/json
Accept-Encoding: gzip, deflate
Accept-Language: zh-CN

{"model":"nomic-embed-text","input":["sample"],"options":{"encoding-format":"float"},"truncate":false}
\`\`\`

In the Windows interface, creating a knowledge base and selecting ollama results in an error. It cannot succeed.
The ollama packet capture is as follows, note that the URL has changed:

\`\`\`
05:25:18.348503 IP 172.31.156.162.61508 > pc142.ms-wbt-server: Flags [P.], seq 3780071696:3780072091, ack 3688591917, win 255, length 395
E...V.@.x.o3......Fo.D.=.OQ...r-P.......POST /v1/api/embed HTTP/1.1
host: 172.29.70.111:3389
connection: keep-alive
Content-Type: application/json
Accept: application/json
User-Agent: ollama-js/0.5.16 (x64 win32 Node.js/v22.21.1)
accept-language: *
sec-fetch-mode: cors
accept-encoding: gzip, deflate
content-length: 102

{"model":"nomic-embed-text","input":["sample"],"options":{"encoding-format":"float"},"truncate":false}
^C
21 packets captured
\`\`\`

### Steps To Reproduce

Directly create a knowledge base and select using ollama embedding model.

### Expected Behavior

None

### Relevant Log Output

\`\`\`shell
None
\`\`\`

---
<details>
<summary>Original Content</summary>

### Issue Checklist

- [x] I understand that issues are for feedback and problem solving, not for complaining in the comment section, and will provide as much information as possible to help solve the problem.
- [x] My issue is not listed in the [FAQ](https://github.com/CherryHQ/cherry-studio/issues/3881).
- [x] I've looked at **pinned issues** and searched for existing [Open Issues](https://github.com/CherryHQ/cherry-studio/issues), [Closed Issues](https://github.com/CherryHQ/cherry-studio/issues?q=is%3Aissue%20state%3Aclosed), and [Discussions](https://github.com/CherryHQ/cherry-studio/discussions), no similar issue or discussion was found.
- [x] I've filled in short, clear headings so that developers can quickly identify a rough idea of what to expect when flipping through the list of issues. And not "a suggestion", "stuck", etc.
- [x] I've confirmed that I am using the latest version of Cherry Studio.

### Platform

Windows

### Version

1.7.1

### Bug Description

在 windows  界面 点击 模型测试。可以成功。
ollama  抓包如下。 注意 URL

root@pc142:/home/osu/ollama_osu# sudo tcpdump -A -s 1500 'tcp port 3389 and (tcp[((tcp[12:1] & 0xf0) >> 2):4] = 0x47455420 or tcp[((tcp[12:1] & 0xf0) >> 2):4] = 0x504f5354)'
libibverbs: Warning: couldn't open config directory '/etc/libibverbs.d'.
tcpdump: verbose output suppressed, use -v[v]... for full protocol decode
listening on eno1np0, link-type EN10MB (Ethernet), snapshot length 1500 bytes

05:28:18.377057 IP 172.31.156.162.18540 > pc142.ms-wbt-server: Flags [P.], seq 4006168713:4006169286, ack 910096718, win 255, length 573
E..eWi@.x.m.......FoHl.=..H.6>.NP.......POST /v1/embeddings HTTP/1.1
Host: 172.29.70.111:3389
Connection: keep-alive
Content-Length: 67
authorization: Bearer
x-stainless-retry-count: 0
x-api-key:
x-title: Cherry Studio
User-Agent: Mozilla/5.0 (Windows NT 10.0; Win64; x64) AppleWebKit/537.36 (KHTML, like Gecko) CherryStudio/1.7.1 Chrome/140.0.7339.249 Electron/38.7.0 Safari/537.36
accept: application/json
http-referer: https://cherry-ai.com
content-type: application/json
Accept-Encoding: gzip, deflate
Accept-Language: zh-CN

————————————————————————————

在 windows 界面，创建知识库，选择ollama  会报错。 无法成功。
ollama  抓包如下 ，注意 URL 改变了

{"model":"nomic-embed-text","input":["sample"],"options":{"encoding-format":"float"},"truncate":false}
05:25:18.348503 IP 172.31.156.162.61508 > pc142.ms-wbt-server: Flags [P.], seq 3780071696:3780072091, ack 3688591917, win 255, length 395
E...V.@.x.o3......Fo.D.=.OQ...r-P.......POST /v1/api/embed HTTP/1.1
host: 172.29.70.111:3389
connection: keep-alive
Content-Type: application/json
Accept: application/json
User-Agent: ollama-js/0.5.16 (x64 win32 Node.js/v22.21.1)
accept-language: *
sec-fetch-mode: cors
accept-encoding: gzip, deflate
content-length: 102

{"model":"nomic-embed-text","input":["sample"],"options":{"encoding-format":"float"},"truncate":false}
^M
^C
21 packets captured

### Steps To Reproduce

直接创建知识库， 选择 使用ollama  embeding 模型。

### Expected Behavior

无

### Relevant Log Output

\`\`\`shell
无
\`\`\`

</details>

**Comment by eeee0717** [comment]
> [!NOTE]
> This issue/comment/review was translated by Claude.

This issue has been fixed, currently it can be solved by adding # after the URL.

---
<details>
<summary>Original Content</summary>

这个问题已修复，目前可以通过在url后加#解决

</details>

**Comment by wjjsn** [comment]
> [!NOTE]
> This issue/comment/review was translated by Claude.

> Note
> 
> This issue/comment/review was translated by Claude.
> 
> This issue has been fixed, currently it can be solved by adding # after the URL.
> Original Content
> 
> 这个问题已修复，目前可以通过在url后加#解决

I have the same problem, adding # doesn't solve the issue. Maybe it's because the Ollama version is too new?
```pwsh
PS C:\Users\wjjsn> curl -X POST http://localhost:11434/v1/embeddings `
>> -H "Content-Type: application/json"`
>> -d '{"model": "embeddinggemma:latest", "input": ["hello"]}'
{"object":"list","data":[{"object":"embedding","embedding":[-0.21425371,-0.019101242,0.050171822,0.0010692348,0.0020514496,0.017271
```
It's obvious in the logs that Cherry Studio is requesting the wrong API:
Ollama logs:
```log
time=2025-12-04T22:40:49.298+08:00 level=INFO source=cpu_windows.go:148 msg=packages count=1
time=2025-12-04T22:40:49.298+08:00 level=INFO source=cpu_windows.go:195 msg="" package=0 cores=8 efficiency=0 threads=16
time=2025-12-04T22:40:49.364+08:00 level=WARN source=server.go:202 msg="flash attention enabled but not supported by model"
time=2025-12-04T22:40:49.367+08:00 level=INFO source=server.go:392 msg="starting runner" cmd="C:\Users\wjjsn\AppData\Local\Programs\Ollama\ollama.exe runner --ollama-engine --model C:\Users\wjjsn\.ollama\models\blobs\sha256-0800cbac9c2064dde519420e75e512a83cb360de3ad5df176185dc69652fc515 --port 63439"
time=2025-12-04T22:40:49.369+08:00 level=INFO source=sched.go:443 msg="system memory" total="31.3 GiB" free="18.9 GiB" free_swap="16.5 GiB"
time=2025-12-04T22:40:49.369+08:00 level=INFO source=server.go:702 msg="loading model" "model layers"=25 requested=-1
time=2025-12-04T22:40:49.401+08:00 level=INFO source=runner.go:1398 msg="starting ollama engine"
time=2025-12-04T22:40:49.404+08:00 level=INFO source=runner.go:1433 msg="Server listening on 127.0.0.1:63439"
time=2025-12-04T22:40:49.413+08:00 level=INFO source=runner.go:1271 msg=load request="{Operation:fit LoraPath:[] Parallel:1 BatchSize:2048 FlashAttention:false KvSize:2048 KvCacheType: NumThreads:8 GPULayers:[] MultiUserCache:false ProjectorPath: MainGPU:0 UseMmap:false}"
time=2025-12-04T22:40:49.437+08:00 level=INFO source=ggml.go:136 msg="" architecture=gemma3 file_type=BF16 name="Embeddinggemma 300M" description="" num_tensors=316 num_key_values=37
load_backend: loaded CPU backend from C:\Users\wjjsn\AppData\Local\Programs\Ollama\lib\ollama\ggml-cpu-icelake.dll
time=2025-12-04T22:40:49.449+08:00 level=INFO source=ggml.go:104 msg=system CPU.0.SSE3=1 CPU.0.SSSE3=1 CPU.0.AVX=1 CPU.0.AVX2=1 CPU.0.F16C=1 CPU.0.FMA=1 CPU.0.BMI2=1 CPU.0.AVX512=1 CPU.0.AVX512_VBMI=1 CPU.0.AVX512_VNNI=1 CPU.0.LLAMAFILE=1 CPU.1.LLAMAFILE=1 compiler=cgo(clang)
time=2025-12-04T22:40:49.455+08:00 level=INFO source=runner.go:1271 msg=load request="{Operation:alloc LoraPath:[] Parallel:1 BatchSize:2048 FlashAttention:false KvSize:2048 KvCacheType: NumThreads:8 GPULayers:[] MultiUserCache:false ProjectorPath: MainGPU:0 UseMmap:false}"
time=2025-12-04T22:40:49.484+08:00 level=INFO source=runner.go:1271 msg=load request="{Operation:commit LoraPath:[] Parallel:1 BatchSize:2048 FlashAttention:false KvSize:2048 KvCacheType: NumThreads:8 GPULayers:[] MultiUserCache:false ProjectorPath: MainGPU:0 UseMmap:false}"
time=2025-12-04T22:40:49.484+08:00 level=INFO source=ggml.go:482 msg="offloading 0 repeating layers to GPU"
time=2025-12-04T22:40:49.484+08:00 level=INFO source=ggml.go:486 msg="offloading output layer to CPU"
time=2025-12-04T22:40:49.484+08:00 level=INFO source=ggml.go:494 msg="offloaded 0/25 layers to GPU"
time=2025-12-04T22:40:49.484+08:00 level=INFO source=device.go:245 msg="model weights" device=CPU size="970.8 MiB"
time=2025-12-04T22:40:49.484+08:00 level=INFO source=device.go:267 msg="compute graph" device=CPU size="72.0 MiB"
time=2025-12-04T22:40:49.484+08:00 level=INFO source=device.go:272 msg="total memory" size="1.0 GiB"
time=2025-12-04T22:40:49.484+08:00 level=INFO source=sched.go:517 msg="loaded runners" count=1
time=2025-12-04T22:40:49.484+08:00 level=INFO source=server.go:1294 msg="waiting for llama runner to start responding"
time=2025-12-04T22:40:49.484+08:00 level=INFO source=server.go:1328 msg="waiting for server to become available" status="llm server loading model"
time=2025-12-04T22:40:49.736+08:00 level=INFO source=server.go:1332 msg="llama runner started in 0.37 seconds"
[GIN] 2025/12/04 - 22:40:49 | 200 |    560.2471ms |             ::1 | POST     "/v1/embeddings"
[GIN] 2025/12/04 - 22:42:26 | 404 |            0s |             ::1 | POST     "/v1/api/embed"
[GIN] 2025/12/04 - 22:42:27 | 404 |            0s |             ::1 | POST     "/v1/api/embed"
[GIN] 2025/12/04 - 22:42:29 | 404 |            0s |             ::1 | POST     "/v1/api/embed"
[GIN] 2025/12/04 - 22:42:37 | 404 |            0s |             ::1 | POST     "/v1/api/embed"
[GIN] 2025/12/04 - 22:42:50 | 404 |            0s |             ::1 | POST     "/v1/api/embed"
[GIN] 2025/12/04 - 22:43:11 | 404 |            0s |             ::1 | POST     "/v1/api/embed"
[GIN] 2025/12/04 - 22:44:04 | 404 |            0s |             ::1 | POST     "/v1/api/embed"
```
Cherry Studio logs
```log
{"attemptNumber":7,"error":"404 page not found","level":"error","message":"Failed to create RAGApplication: 404 page not found","name":"ResponseError","retriesLeft":0,"stack":"ResponseError: 404 page not found\n    at checkOk (C:\Users\wjjsn\AppData\Local\Programs\Cherry Studio\resources\app.asar\out\main\index.js:529461:8)\n    at process.processTicksAndRejections (node:internal/process/task_queues:105:5)\n    at async post (C:\Users\wjjsn\AppData\Local\Programs\Cherry Studio\resources\app.asar\out\main\index.js:529512:2)\n    at async Ollama.embed (C:\Users\wjjsn\AppData\Local\Programs\Cherry Studio\resources\app.asar\out\main\index.js:529670:20)\n    at async RetryOperation._fn (C:\Users\wjjsn\AppData\Local\Programs\Cherry Studio\resources\app.asar\out\main\index.js:234023:15)","status_code":404,"timestamp":"2025-12-04 22:44:04"}
{"level":"error","message":"Failed to add item: Failed to create RAGApplication: ResponseError: 404 page not found","stack":"Error: Failed to create RAGApplication: ResponseError: 404 page not found\n    at KnowledgeService.getRagApplication (C:\Users\wjjsn\AppData\Local\Programs\Cherry Studio\resources\app.asar\out\main\index.js:579434:10)\n    at process.processTicksAndRejections (node:internal/process/task_queues:105:5)","timestamp":"2025-12-04 22:44:04"}
{"level":"error","message":"Backend processing error for item 95b8d384-4100-47bf-a7d0-252b1b37b5df: Failed to add item: Failed to create RAGApplication: ResponseError: 404 page not found","module":"KnowledgeQueue","process":"renderer","timestamp":"2025-12-04 22:44:04","window":"mainWindow"}
{"level":"error","message":"Error processing item 95b8d384-4100-47bf-a7d0-252b1b37b5df:  嵌入失败: Failed to add item: Failed to create RAGApplication: ResponseError: 404 page not found","stack":"Error: 嵌入失败: Failed to add item: Failed to create RAGApplication: ResponseError: 404 page not found","timestamp":"2025-12-04 22:44:04"}
{"level":"error","message":"Error getting embedding dimensions: 405 405 method not allowed","stack":"Error: 405 405 method not allowed\n    at async checkApi (file:///C:/Users/wjjsn/AppData/Local/Programs/Cherry%20Studio/resources/app.asar/out/renderer/assets/store-Z-tJeJfQ.js:261220:3)\n    at async checkModel (file:///C:/Users/wjjsn/AppData/Local/Programs/Cherry%20Studio/resources/app.asar/out/renderer/assets/store-Z-tJeJfQ.js:261255:2)\n    at async file:///C:/Users/wjjsn/AppData/Local/Programs/Cherry%20Studio/resources/app.asar/out/renderer/assets/index-BpCSAivR.js:120766:3\n    at async Promise.allSettled (index 0)\n    at async checkModelWithMultipleKeys (file:///C:/Users/wjjsn/AppData/Local/Programs/Cherry%20Studio/resources/app.asar/out/renderer/assets/index-BpCSAivR.js:120777:18)\n    at async file:///C:/Users/wjjsn/AppData/Local/Programs/Cherry%20Studio/resources/app.asar/out/renderer/assets/index-BpCSAivR.js:120792:23\n    at async Promise.all (index 0)\n    at async checkModelsHealth (file:///C:/Users/wjjsn/AppData/Local/Programs/Cherry%20Studio/resources/app.asar/out/renderer/assets/index-BpCSAivR.js:120806:21)\n    at async Object.onClick (file:///C:/Users/wjjsn/AppData/Local/Programs/Cherry%20Studio/resources/app.asar/out/renderer/assets/index-BpCSAivR.js:120843:24)","timestamp":"2025-12-04 22:58:25"}
{"level":"error","message":"Error getting embedding dimensions: 405 405 method not allowed","stack":"Error: 405 405 method not allowed\n    at async checkApi (file:///C:/Users/wjjsn/AppData/Local/Programs/Cherry%20Studio/resources/app.asar/out/renderer/assets/store-Z-tJeJfQ.js:261220:3)\n    at async checkModel (file:///C:/Users/wjjsn/AppData/Local/Programs/Cherry%20Studio/resources/app.asar/out/renderer/assets/store-Z-tJeJfQ.js:261255:2)\n    at async file:///C:/Users/wjjsn/AppData/Local/Programs/Cherry%20Studio/resources/app.asar/out/renderer/assets/index-BpCSAivR.js:120766:3\n    at async Promise.allSettled (index 0)\n    at async checkModelWithMultipleKeys (file:///C:/Users/wjjsn/AppData/Local/Programs/Cherry%20Studio/resources/app.asar/out/renderer/assets/index-BpCSAivR.js:120777:18)\n    at async file:///C:/Users/wjjsn/AppData/Local/Programs/Cherry%20Studio/resources/app.asar/out/renderer/assets/index-BpCSAivR.js:120792:23\n    at async Promise.all (index 0)\n    at async checkModelsHealth (file:///C:/Users/wjjsn/AppData/Local/Programs/Cherry%20Studio/resources/app.asar/out/renderer/assets/index-BpCSAivR.js:120806:21)\n    at async Object.onClick (file:///C:/Users/wjjsn/AppData/Local/Programs/Cherry%20Studio/resources/app.asar/out/renderer/assets/index-BpCSAivR.js:120843:24)","timestamp":"2025-12-04 22:58:56"}
```
<img width="1492" alt="Image" src="https://github.com/user-attachments/assets/e634504a-2c8d-4601-996c-b0395e7ef549" />

---
<details>
<summary>Original Content</summary>

> Note
> 
> This issue/comment/review was translated by Claude.
> 
> This issue has been fixed, currently it can be solved by adding # after the URL.
> Original Content
> 
> 这个问题已修复，目前可以通过在url后加#解决

我也有相同的问题，加#并不能解决问题。也许是因为ollama版本过新？
```pwsh
PS C:\Users\wjjsn> curl -X POST http://localhost:11434/v1/embeddings `
>> -H "Content-Type: application/json"`
>> -d '{"model": "embeddinggemma:latest", "input": ["hello"]}'
{"object":"list","data":[{"object":"embedding","embedding":[-0.21425371,-0.019101242,0.050171822,0.0010692348,0.0020514496,0.017271
```
很明显的在日志中能看到cherry studio请求了错误的API：
ollama的日志：
```log
time=2025-12-04T22:40:49.298+08:00 level=INFO source=cpu_windows.go:148 msg=packages count=1
time=2025-12-04T22:40:49.298+08:00 level=INFO source=cpu_windows.go:195 msg="" package=0 cores=8 efficiency=0 threads=16
time=2025-12-04T22:40:49.364+08:00 level=WARN source=server.go:202 msg="flash attention enabled but not supported by model"
time=2025-12-04T22:40:49.367+08:00 level=INFO source=server.go:392 msg="starting runner" cmd="C:\Users\wjjsn\AppData\Local\Programs\Ollama\ollama.exe runner --ollama-engine --model C:\Users\wjjsn\.ollama\models\blobs\sha256-0800cbac9c2064dde519420e75e512a83cb360de3ad5df176185dc69652fc515 --port 63439"
time=2025-12-04T22:40:49.369+08:00 level=INFO source=sched.go:443 msg="system memory" total="31.3 GiB" free="18.9 GiB" free_swap="16.5 GiB"
time=2025-12-04T22:40:49.369+08:00 level=INFO source=server.go:702 msg="loading model" "model layers"=25 requested=-1
time=2025-12-04T22:40:49.401+08:00 level=INFO source=runner.go:1398 msg="starting ollama engine"
time=2025-12-04T22:40:49.404+08:00 level=INFO source=runner.go:1433 msg="Server listening on 127.0.0.1:63439"
time=2025-12-04T22:40:49.413+08:00 level=INFO source=runner.go:1271 msg=load request="{Operation:fit LoraPath:[] Parallel:1 BatchSize:2048 FlashAttention:false KvSize:2048 KvCacheType: NumThreads:8 GPULayers:[] MultiUserCache:false ProjectorPath: MainGPU:0 UseMmap:false}"
time=2025-12-04T22:40:49.437+08:00 level=INFO source=ggml.go:136 msg="" architecture=gemma3 file_type=BF16 name="Embeddinggemma 300M" description="" num_tensors=316 num_key_values=37
load_backend: loaded CPU backend from C:\Users\wjjsn\AppData\Local\Programs\Ollama\lib\ollama\ggml-cpu-icelake.dll
time=2025-12-04T22:40:49.449+08:00 level=INFO source=ggml.go:104 msg=system CPU.0.SSE3=1 CPU.0.SSSE3=1 CPU.0.AVX=1 CPU.0.AVX2=1 CPU.0.F16C=1 CPU.0.FMA=1 CPU.0.BMI2=1 CPU.0.AVX512=1 CPU.0.AVX512_VBMI=1 CPU.0.AVX512_VNNI=1 CPU.0.LLAMAFILE=1 CPU.1.LLAMAFILE=1 compiler=cgo(clang)
time=2025-12-04T22:40:49.455+08:00 level=INFO source=runner.go:1271 msg=load request="{Operation:alloc LoraPath:[] Parallel:1 BatchSize:2048 FlashAttention:false KvSize:2048 KvCacheType: NumThreads:8 GPULayers:[] MultiUserCache:false ProjectorPath: MainGPU:0 UseMmap:false}"
time=2025-12-04T22:40:49.484+08:00 level=INFO source=runner.go:1271 msg=load request="{Operation:commit LoraPath:[] Parallel:1 BatchSize:2048 FlashAttention:false KvSize:2048 KvCacheType: NumThreads:8 GPULayers:[] MultiUserCache:false ProjectorPath: MainGPU:0 UseMmap:false}"
time=2025-12-04T22:40:49.484+08:00 level=INFO source=ggml.go:482 msg="offloading 0 repeating layers to GPU"
time=2025-12-04T22:40:49.484+08:00 level=INFO source=ggml.go:486 msg="offloading output layer to CPU"
time=2025-12-04T22:40:49.484+08:00 level=INFO source=ggml.go:494 msg="offloaded 0/25 layers to GPU"
time=2025-12-04T22:40:49.484+08:00 level=INFO source=device.go:245 msg="model weights" device=CPU size="970.8 MiB"
time=2025-12-04T22:40:49.484+08:00 level=INFO source=device.go:267 msg="compute graph" device=CPU size="72.0 MiB"
time=2025-12-04T22:40:49.484+08:00 level=INFO source=device.go:272 msg="total memory" size="1.0 GiB"
time=2025-12-04T22:40:49.484+08:00 level=INFO source=sched.go:517 msg="loaded runners" count=1
time=2025-12-04T22:40:49.484+08:00 level=INFO source=server.go:1294 msg="waiting for llama runner to start responding"
time=2025-12-04T22:40:49.484+08:00 level=INFO source=server.go:1328 msg="waiting for server to become available" status="llm server loading model"
time=2025-12-04T22:40:49.736+08:00 level=INFO source=server.go:1332 msg="llama runner started in 0.37 seconds"
[GIN] 2025/12/04 - 22:40:49 | 200 |    560.2471ms |             ::1 | POST     "/v1/embeddings"
[GIN] 2025/12/04 - 22:42:26 | 404 |            0s |             ::1 | POST     "/v1/api/embed"
[GIN] 2025/12/04 - 22:42:27 | 404 |            0s |             ::1 | POST     "/v1/api/embed"
[GIN] 2025/12/04 - 22:42:29 | 404 |            0s |             ::1 | POST     "/v1/api/embed"
[GIN] 2025/12/04 - 22:42:37 | 404 |            0s |             ::1 | POST     "/v1/api/embed"
[GIN] 2025/12/04 - 22:42:50 | 404 |            0s |             ::1 | POST     "/v1/api/embed"
[GIN] 2025/12/04 - 22:43:11 | 404 |            0s |             ::1 | POST     "/v1/api/embed"
[GIN] 2025/12/04 - 22:44:04 | 404 |            0s |             ::1 | POST     "/v1/api/embed"
```
cherry studio的日志
```log
{"attemptNumber":7,"error":"404 page not found","level":"error","message":"Failed to create RAGApplication: 404 page not found","name":"ResponseError","retriesLeft":0,"stack":"ResponseError: 404 page not found\n    at checkOk (C:\Users\wjjsn\AppData\Local\Programs\Cherry Studio\resources\app.asar\out\main\index.js:529461:8)\n    at process.processTicksAndRejections (node:internal/process/task_queues:105:5)\n    at async post (C:\Users\wjjsn\AppData\Local\Programs\Cherry Studio\resources\app.asar\out\main\index.js:529512:2)\n    at async Ollama.embed (C:\Users\wjjsn\AppData\Local\Programs\Cherry Studio\resources\app.asar\out\main\index.js:529670:20)\n    at async RetryOperation._fn (C:\Users\wjjsn\AppData\Local\Programs\Cherry Studio\resources\app.asar\out\main\index.js:234023:15)","status_code":404,"timestamp":"2025-12-04 22:44:04"}
{"level":"error","message":"Failed to add item: Failed to create RAGApplication: ResponseError: 404 page not found","stack":"Error: Failed to create RAGApplication: ResponseError: 404 page not found\n    at KnowledgeService.getRagApplication (C:\Users\wjjsn\AppData\Local\Programs\Cherry Studio\resources\app.asar\out\main\index.js:579434:10)\n    at process.processTicksAndRejections (node:internal/process/task_queues:105:5)","timestamp":"2025-12-04 22:44:04"}
{"level":"error","message":"Backend processing error for item 95b8d384-4100-47bf-a7d0-252b1b37b5df: Failed to add item: Failed to create RAGApplication: ResponseError: 404 page not found","module":"KnowledgeQueue","process":"renderer","timestamp":"2025-12-04 22:44:04","window":"mainWindow"}
{"level":"error","message":"Error processing item 95b8d384-4100-47bf-a7d0-252b1b37b5df:  嵌入失败: Failed to add item: Failed to create RAGApplication: ResponseError: 404 page not found","stack":"Error: 嵌入失败: Failed to add item: Failed to create RAGApplication: ResponseError: 404 page not found","timestamp":"2025-12-04 22:44:04"}
{"level":"error","message":"Error getting embedding dimensions: 405 405 method not allowed","stack":"Error: 405 405 method not allowed\n    at async checkApi (file:///C:/Users/wjjsn/AppData/Local/Programs/Cherry%20Studio/resources/app.asar/out/renderer/assets/store-Z-tJeJfQ.js:261220:3)\n    at async checkModel (file:///C:/Users/wjjsn/AppData/Local/Programs/Cherry%20Studio/resources/app.asar/out/renderer/assets/store-Z-tJeJfQ.js:261255:2)\n    at async file:///C:/Users/wjjsn/AppData/Local/Programs/Cherry%20Studio/resources/app.asar/out/renderer/assets/index-BpCSAivR.js:120766:3\n    at async Promise.allSettled (index 0)\n    at async checkModelWithMultipleKeys (file:///C:/Users/wjjsn/AppData/Local/Programs/Cherry%20Studio/resources/app.asar/out/renderer/assets/index-BpCSAivR.js:120777:18)\n    at async file:///C:/Users/wjjsn/AppData/Local/Programs/Cherry%20Studio/resources/app.asar/out/renderer/assets/index-BpCSAivR.js:120792:23\n    at async Promise.all (index 0)\n    at async checkModelWithMultipleKeys (file:///C:/Users/wjjsn/AppData/Local/Programs/Cherry%20Studio/resources/app.asar/out/renderer/assets/index-BpCSAivR.js:120806:21)\n    at async Object.onClick (file:///C:/Users/wjjsn/AppData/Local/Programs/Cherry%20Studio/resources/app.asar/out/renderer/assets/index-BpCSAivR.js:120843:24)","timestamp":"2025-12-04 22:58:25"}
{"level":"error","message":"Error getting embedding dimensions: 405 405 method not allowed","stack":"Error: 405 405 method not allowed\n    at async checkApi (file:///C:/Users/wjjsn/AppData/Local/Programs/Cherry%20Studio/resources/app.asar/out/renderer/assets/store-Z-tJeJfQ.js:261220:3)\n    at async checkModel (file:///C:/Users/wjjsn/AppData/Local/Programs/Cherry%20Studio/resources/app.asar/out/renderer/assets/store-Z-tJeJfQ.js:261255:2)\n    at async file:///C:/Users/wjjsn/AppData/Local/Programs/Cherry%20Studio/resources/app.asar/out/renderer/assets/index-BpCSAivR.js:120766:3\n    at async Promise.allSettled (index 0)\n    at async checkModelWithMultipleKeys (file:///C:/Users/wjjsn/AppData/Local/Programs/Cherry%20Studio/resources/app.asar/out/renderer/assets/index-BpCSAivR.js:120777:18)\n    at async file:///C:/Users/wjjsn/AppData/Local/Programs/Cherry%20Studio/resources/app.asar/out/renderer/assets/index-BpCSAivR.js:120792:23)\n    at async Promise.all (index 0)\n    at async checkModelWithMultipleKeys (file:///C:/Users/wjjsn/AppData/Local/Programs/Cherry%20Studio/resources/app.asar/out/renderer/assets/index-BpCSAivR.js:120777:18)\n    at async file:///C:/Users/wjjsn/AppData/Local/Programs/Cherry%20Studio/resources/app.asar/out/renderer/assets/index-BpCSAivR.js:120792:23\n    at async Promise.all (index 0)\n    at async checkModelsHealth (file:///C:/Users/wjjsn/AppData/Local/Programs/Cherry%20Studio/resources/app.asar/out/renderer/assets/index-BpCSAivR.js:120806:21)\n    at async Object.onClick (file:///C:/Users/wjjsn/AppData/Local/Programs/Cherry%20Studio/resources/app.asar/out/renderer/assets/index-BpCSAivR.js:120843:24)","timestamp":"2025-12-04 22:58:56"}
```
<img width="1492" height="931" alt="Image" src="https://github.com/user-attachments/assets/e634504a-2c8d-4601-996c-b0395e7ef549" />

</details>

**Comment by wjjsn** [comment]
> [!NOTE]
> This issue/comment/review was translated by Claude.

Well, although the model health test failed, adding # did indeed work successfully.

---
<details>
<summary>Original Content</summary>

好吧，虽然模型健康测试失败了，但加#确实运行成功了

</details>

**Comment by zzh1307** [comment]
> [!NOTE]
> This issue/comment/review was translated by Claude.

Same problem, hope it gets fixed soon.

---
<details>
<summary>Original Content</summary>

同样的问题，希望早日修复

</details>
